id;author_id;title;slug;excerpt;body;original_link;image;created_at;updated_at;published_at;category_id;views;deleted_at;keywords;recommended;meta_id
711091;22;"Elektrická vlna: pod proudem jsou dodávky i supersport";elektricka-vlna-pod-proudem-jsou-dodavky-i-supersport;"Nutnost plnit přísné limity na emise CO2 vede k urychlenému uvádění dalších a dalších elektromobilů. Ten, kdo dokáže zaujmout a prodat hodně elektrických aut, si může dovolit prodávat ve velkém i auta konvenční.";"Nutnost plnit přísné limity na emise CO2 vede k urychlenému uvádění dalších a dalších elektromobilů. Ten, kdo dokáže zaujmout a prodat hodně elektrických aut, si může dovolit prodávat ve velkém i auta konvenční.<p><a href='https://www.idnes.cz/auto/zpravodajstvi/porsche-elektromobil-volvo-skoda-audi-peugeot-mercedes-hyundai.A210304_192447_automoto_fdv#utm_source=rss&utm_medium=feed&utm_campaign=autokat&utm_content=main'><b>Odkaz na původní článek</b></a></p>";https://www.idnes.cz/auto/zpravodajstvi/porsche-elektromobil-volvo-skoda-audi-peugeot-mercedes-hyundai.A210304_192447_automoto_fdv#utm_source=rss&utm_medium=feed&utm_campaign=autokat&utm_content=main;default.jpg;"2021-03-11 12:30:25";"2021-03-11 12:30:25";"2021-03-11 12:30:25";14;0;NULL;"emise co2 vede nutnost plnit přísné limity emise dalších urychlenému uvádění dalších elektromobilů dalších elektromobilů vede dokáže zaujmout emise dovolit prodávat nutnost";"[{"slug": "volva-budou-od-roku-2030-elektricka-koupite-je-pres-e-shop-a-bez-smlouvani", "coefficient": 0.31907733730591514}, {"slug": "jarni-autonovinkou-je-elektricka-skoda-enyaq-oceneni-jsou-i-ctenari", "coefficient": 0.298375017712212}, {"slug": "chcete-vyvinout-a-vyrobit-auto-v-rakousku-umi-vsechno-offroad-i-supersport", "coefficient": 0.2964832200833934}, {"slug": "milionovy-nos-vyvojarka-parfemu-provoni-luxusni-bmw-vyvoj-trva-roky", "coefficient": 0.29352929203212136}, {"slug": "automobilky-na-rozcesti-sebevrazda-elektrickym-proudem-je-jedinou-moznosti", "coefficient": 0.2909321131453826}, {"slug": "tajemna-elektricka-kia-nastartuje-novou-eru-zatim-je-ve-stinu", "coefficient": 0.2906320623812365}, {"slug": "evropa-predstihla-cinu-v-prodejich-elektroaut-tahounem-jsou-nemecke-dotace", "coefficient": 0.2851660323662327}, {"slug": "autopowerbanky-policek-energetickym-smejdum-a-flotily-enyaqu-misto-dukovan", "coefficient": 0.28248938562951076}, {"slug": "elektricka-kia-je-symbolem-prerodu-znacky-spalovaci-motory-zatim-nezavrhla", "coefficient": 0.28168633367378565}, {"slug": "huawei-planuje-vyrobu-elektromobilu-predstavi-je-snad-uz-letos", "coefficient": 0.2807060019347486}]";NULL
711491;22;"Žádná dutá krabice. Nový Hyundai Tuscon vyvolává skutečné emoce";zadna-duta-krabice-novy-hyundai-tuscon-vyvolava-skutecne-emoce;"Když nový Tucson postavíte vedle předchozí generace, která je sice vcelku pohledná, ale zoufale konvenční, vypadá jako auto od úplně jiné automobilky. Hyundai učinil další ze svých vývojových skoků, tentokrát na poli designu.";"Když nový Tucson postavíte vedle předchozí generace, která je sice vcelku pohledná, ale zoufale konvenční, vypadá jako auto od úplně jiné automobilky. Hyundai učinil další ze svých vývojových skoků, tentokrát na poli designu.<p><a href='https://www.idnes.cz/auto/magazin/auto-hyunday-tucson-premiovy-design.A210211_133533_auto_testy_nea#utm_source=rss&utm_medium=feed&utm_campaign=autokat&utm_content=main'><b>Odkaz na původní článek</b></a></p>";https://www.idnes.cz/auto/magazin/auto-hyunday-tucson-premiovy-design.A210211_133533_auto_testy_nea#utm_source=rss&utm_medium=feed&utm_campaign=autokat&utm_content=main;default.jpg;"2021-03-11 16:31:38";"2021-03-11 16:31:38";"2021-03-11 16:31:38";14;0;NULL;"vcelku pohledná tentokrát poli zoufale zoufale konvenční tucson postavíte předchozí pohledná hyundai učinil sice vývojových skoků generace poli designu nový";"[{"slug": "hyundai-v-cesku-svola-13-000-suv-z-nosovic-tucsony-jedou-do-servisu-s-abs", "coefficient": 0.324659237973507}, {"slug": "autofotka-tydne-z-tajneho-archivu-skody-prvni-fabii-navrhl-brazilec", "coefficient": 0.2949785060577095}, {"slug": "dojezd-elektrickych-nissanu-prodlouzi-spalovaci-motor-s-rekordni-ucinnosti", "coefficient": 0.29326276991678674}, {"slug": "hyundai-meni-u-elektromobilu-vadne-baterie-auta-z-nosovic-jsou-v-poradku", "coefficient": 0.2899893185138959}, {"slug": "novy-superb-dorazi-za-dva-roky-cesky-designer-nacrtl-jak-by-mohl-vypadat", "coefficient": 0.2869862275057917}, {"slug": "normalni-auta-jeste-nevymrela-ds-veze-styl-bmw-emoce", "coefficient": 0.2863003945308856}, {"slug": "za-4-roky-uvede-seat-levny-mestsky-elektromobil-bude-stat-pres-pul-milionu", "coefficient": 0.28118934436255894}, {"slug": "designer-automobilovych-katedral-citroenu-a-renaultu-zemrel-kvuli-covidu", "coefficient": 0.277979305972568}, {"slug": "novy-mercedes-c-je-zmensena-trida-s-ale-dostane-jen-ctyrvalce", "coefficient": 0.27650405452335175}, {"slug": "krasny-elektrohyundai-ma-byt-prelomem-nabije-i-vsechno-ostatni", "coefficient": 0.2757686754675726}]";NULL
711501;22;"Méně nabíjecích stanic pro elektroauta mají jen Slováci, Řekové a Poláci";mene-nabijecich-stanic-pro-elektroauta-maji-jen-slovaci-rekove-a-polaci;"Můžeme si o elektromobilitě myslet, co chceme, ale pokud už řada výrobců vyhlásila, že chce vyrábět jen elektrická auta, na obzoru je velmi přísná emisní norma Euro7, které budou moct vyhovět téměř jen elektromobily, tak musí být na tuto změnu připravená i infrastruktura a legislativa. V obojím Česko za zeměmi na západ od nás zaostává.";"Můžeme si o elektromobilitě myslet, co chceme, ale pokud už řada výrobců vyhlásila, že chce vyrábět jen elektrická auta, na obzoru je velmi přísná emisní norma Euro7, které budou moct vyhovět téměř jen elektromobily, tak musí být na tuto změnu připravená i infrastruktura a legislativa. V obojím Česko za zeměmi na západ od nás zaostává.<p><a href='https://www.idnes.cz/auto/zpravodajstvi/elektromobil-nabijeni-ekologicke-vozidlo-nabijecka.A210115_172638_automoto_fdv#utm_source=rss&utm_medium=feed&utm_campaign=autokat&utm_content=main'><b>Odkaz na původní článek</b></a></p>";https://www.idnes.cz/auto/zpravodajstvi/elektromobil-nabijeni-ekologicke-vozidlo-nabijecka.A210115_172638_automoto_fdv#utm_source=rss&utm_medium=feed&utm_campaign=autokat&utm_content=main;default.jpg;"2021-03-11 16:31:39";"2021-03-11 16:31:39";"2021-03-11 16:31:39";14;0;NULL;"řada výrobců vyhlásila auta obzoru vyhlásila elektromobilitě myslet vyhlásila vyrábět elektrická pokud chce vyrábět myslet elektrická auta můžeme změnu připravená chceme";"[{"slug": "cinsky-vyrobce-smartphonu-xiaomi-se-chysta-vyrabet-elektromobily", "coefficient": 0.3173097218139603}, {"slug": "pocet-nabijecich-stanic-letos-hodne-naroste-pokukuji-po-nich-i-benzinky", "coefficient": 0.31675496593492947}, {"slug": "elektroauta-neni-kde-nabijet-evropa-musi-pridat-lamentuji-vyrobci", "coefficient": 0.29948049495560347}, {"slug": "jaguary-budou-od-roku-2025-jen-elektricke-landrovery-o-pet-let-pozdeji", "coefficient": 0.2986406265510812}, {"slug": "slovaci-snili-o-alfe-postavili-garde-turbo-a-navrhli-nakladni-stodvacitku", "coefficient": 0.29779781964154894}, {"slug": "toyota-chce-zachranit-tridu-nejmensich-aut-nove-kolinske-aygo-poodhaleno", "coefficient": 0.29332843136561054}, {"slug": "auta-cechu-patri-k-nejstarsim-v-evrope-prumer-roste-kvuli-dovozu", "coefficient": 0.29326308636303616}, {"slug": "autofotka-tydne-aventadoru-je-deset-let-zurivec-bez-strechy-je-jediny", "coefficient": 0.2914958342617233}, {"slug": "novy-mercedes-c-je-zmensena-trida-s-ale-dostane-jen-ctyrvalce", "coefficient": 0.28887879413339407}, {"slug": "policie-prevezme-defendery-moderni-drsnacke-landrovery-nabidnou-i-armade", "coefficient": 0.26178821348551873}]";NULL
711511;22;"Škoda Octavia Pro nabízí Číňanům víc místa pro nohy";skoda-octavia-pro-nabizi-cinanum-vic-mista-pro-nohy;"Proč se nová varianta nejdůležitější škodovky jmenuje Octavia Pro, automobilka nevysvětlila, můžeme to ale třeba chápat jako PROdloužená. Automobilka upravila nejnovější generaci modelu tak, aby víc lákala zákazníky v Číně. Protáhla kabinu, takže mají cestující vzadu o víc než čtyři centimetry místa navíc pro nohy.";"Proč se nová varianta nejdůležitější škodovky jmenuje Octavia Pro, automobilka nevysvětlila, můžeme to ale třeba chápat jako PROdloužená. Automobilka upravila nejnovější generaci modelu tak, aby víc lákala zákazníky v Číně. Protáhla kabinu, takže mají cestující vzadu o víc než čtyři centimetry místa navíc pro nohy.<p><a href='https://www.idnes.cz/auto/zpravodajstvi/skoda-octavia-pro-prodlouzena-kushaq-rozvor-cina.A210310_210644_automoto_vok#utm_source=rss&utm_medium=feed&utm_campaign=autokat&utm_content=main'><b>Odkaz na původní článek</b></a></p>";https://www.idnes.cz/auto/zpravodajstvi/skoda-octavia-pro-prodlouzena-kushaq-rozvor-cina.A210310_210644_automoto_vok#utm_source=rss&utm_medium=feed&utm_campaign=autokat&utm_content=main;default.jpg;"2021-03-11 16:31:39";"2021-03-11 16:31:39";"2021-03-11 16:31:39";14;0;NULL;"mají cestující vzadu víc můžeme víc lákala zákazníky automobilka nevysvětlila automobilka nevysvětlila navíc pro třeba chápat varianta nejdůležitější nová protáhla kabinu automobilka";"[{"slug": "skoda-ma-byt-klicem-k-uspechu-v-asii-pro-cely-koncern-vw", "coefficient": 0.35717673829186586}, {"slug": "v-pondeli-vyhlasi-evropske-auto-roku-sanci-ma-i-skoda-octavia", "coefficient": 0.32677872387295376}, {"slug": "skoda-ukazuje-prvni-foto-nove-fabie-zustane-u-benzinu-premiera-bude-zjara", "coefficient": 0.31809006474964796}, {"slug": "rusky-ministr-odhalil-plan-vyroby-miniauta-na-elektrinu-vyjede-jeste-letos", "coefficient": 0.31281516739537496}, {"slug": "elektricka-kia-je-symbolem-prerodu-znacky-spalovaci-motory-zatim-nezavrhla", "coefficient": 0.31191799818690924}, {"slug": "vw-chysta-v-evrope-sest-tovaren-na-baterie-do-elektroaut-ve-hre-je-i-cesko", "coefficient": 0.3118854234381397}, {"slug": "uz-i-v-koline-dosly-cipy-toyota-zastavi-vyrobu-na-dva-tydny", "coefficient": 0.31048456208241904}, {"slug": "skoda-kodiaq-dostala-novou-prid-rso-vymenilo-tdi-za-benzin", "coefficient": 0.3070453343474327}, {"slug": "honda-vsechny-predjela-nabizi-auto-ve-kterem-si-v-zacpe-prectete-noviny", "coefficient": 0.301260773936685}, {"slug": "hyundai-meni-u-elektromobilu-vadne-baterie-auta-z-nosovic-jsou-v-poradku", "coefficient": 0.3043685357900501}]";NULL
712131;22;"Nejmenší toyota z Kolína dostane nástupce. V Evropě možná bude bez soupeřů";nejmensi-toyota-z-kolina-dostane-nastupce-v-evrope-mozna-bude-bez-souperu;"Toyota potvrdila, že její nejmenší model Aygo dostane nástupce. A to navzdory tomu, že skončilo partnerství, v rámci kterého vznikaly stávající minivozy v kolínské továrně. Je dost pravděpodobné, že japonská značka díky mohutné hybridizaci srážející její flotilové emise, nabídne mrňavé benzinové auto v Evropě jako jediná.";"Toyota potvrdila, že její nejmenší model Aygo dostane nástupce. A to navzdory tomu, že skončilo partnerství, v rámci kterého vznikaly stávající minivozy v kolínské továrně. Je dost pravděpodobné, že japonská značka díky mohutné hybridizaci srážející její flotilové emise, nabídne mrňavé benzinové auto v Evropě jako jediná.<p><a href='https://www.idnes.cz/auto/zpravodajstvi/toyota-potvrdila-aygo-dostane-nastupce.A210310_220527_automoto_vok#utm_source=rss&utm_medium=feed&utm_campaign=autokat&utm_content=main'><b>Odkaz na původní článek</b></a></p>";https://www.idnes.cz/auto/zpravodajstvi/toyota-potvrdila-aygo-dostane-nastupce.A210310_220527_automoto_vok#utm_source=rss&utm_medium=feed&utm_campaign=autokat&utm_content=main;default.jpg;"2021-03-12 00:44:40";"2021-03-12 00:44:40";"2021-03-12 00:44:40";14;0;NULL;"toyota potvrdila v model navzdory tomu aygo dostane nástupce skončilo partnerství potvrdila nejmenší nejmenší kolínské továrně potvrdila dost pravděpodobné toyota";"[{"slug": "toyota-chce-zachranit-tridu-nejmensich-aut-nove-kolinske-aygo-poodhaleno", "coefficient": 0.3794355283347022}, {"slug": "toyota-celica-legendarni-drsnacke-kupe-ukoncilo-karieru-pred-15-lety", "coefficient": 0.34327498178060795}, {"slug": "uz-i-v-koline-dosly-cipy-toyota-zastavi-vyrobu-na-dva-tydny", "coefficient": 0.3298906737593592}, {"slug": "autem-roku-je-yaris-toyota-ho-bude-od-letoska-vyrabet-v-cesku", "coefficient": 0.3257289532022919}, {"slug": "fenomen-toyota-v-krizi-neohrozene-jede-ted-stavi-mesto-budoucnosti", "coefficient": 0.3177677067877787}, {"slug": "autofotka-tydne-nejmensi-mazda-se-vesla-do-kufru-v-evrope-ho-ztratili", "coefficient": 0.3089493215026366}, {"slug": "mitsubishi-nakonec-v-evrope-zustane-bude-prodavat-i-renaulty", "coefficient": 0.2966785615888503}, {"slug": "era-dieselovych-stihacek-konci-270-koni-benzinoveho-superbu-jede-a-nezere", "coefficient": 0.28301739435572193}, {"slug": "novy-mercedes-c-je-zmensena-trida-s-ale-dostane-jen-ctyrvalce", "coefficient": 0.2827615944253812}, {"slug": "autofotka-tydne-aventadoru-je-deset-let-zurivec-bez-strechy-je-jediny", "coefficient": 0.2821169510418339}]";NULL
712141;22;"Autoservisy zejí prázdnotou. Nově lákají na akce, můžete ušetřit";autoservisy-zeji-prazdnotou-nove-lakaji-na-akce-muzete-usetrit;"Ačkoli prodej nových vozů je nyní možný pouze online, servisy můžou být otevřené. Přesto do nich jezdí málo lidí. Někteří nevědí, že mají otevřeno, jiní se bojí překračovat hranice mezi okresy. Situace je horší v menších městech než v Praze.";"Ačkoli prodej nových vozů je nyní možný pouze online, servisy můžou být otevřené. Přesto do nich jezdí málo lidí. Někteří nevědí, že mají otevřeno, jiní se bojí překračovat hranice mezi okresy. Situace je horší v menších městech než v Praze.<p><a href='https://www.idnes.cz/auto/zpravodajstvi/servis-autoservis-obsazenost.A210126_094951_automoto_fdv#utm_source=rss&utm_medium=feed&utm_campaign=autokat&utm_content=main'><b>Odkaz na původní článek</b></a></p>";https://www.idnes.cz/auto/zpravodajstvi/servis-autoservis-obsazenost.A210126_094951_automoto_fdv#utm_source=rss&utm_medium=feed&utm_campaign=autokat&utm_content=main;default.jpg;"2021-03-12 00:44:41";"2021-03-12 00:44:41";"2021-03-12 00:44:41";14;0;NULL;"bojí překračovat hranice v nových nyní možný nových vozů nyní možný otevřené servisy můžou servisy někteří nevědí online mají otevřeno prodej";"[{"slug": "covidovy-paradox-poptavka-po-levnejsich-autech-spis-klesa", "coefficient": 0.30352853111044475}, {"slug": "elektricke-citigo-je-bazarovy-hit-lezakem-je-range-rover", "coefficient": 0.3034577127835221}, {"slug": "evropa-predstihla-cinu-v-prodejich-elektroaut-tahounem-jsou-nemecke-dotace", "coefficient": 0.30132622037847107}, {"slug": "autoservisy-po-sesti-tydnech-oteviraji-cekaji-naval", "coefficient": 0.29053604987161336}, {"slug": "prezouvani-na-leto-brzdi-koronauzavera-cesi-se-snazi-usetrit", "coefficient": 0.28859727414984004}, {"slug": "ridici-neznaji-pravidla-jizdy-po-kruhovem-objezdu-zopakujte-si-je", "coefficient": 0.2862583182862159}, {"slug": "hyundai-v-cesku-svola-13-000-suv-z-nosovic-tucsony-jedou-do-servisu-s-abs", "coefficient": 0.2851049900028255}, {"slug": "za-volantem-bez-ridicaku-i-obcanky-do-senatu-miri-zakon-o-digitalizaci", "coefficient": 0.2809418180421368}, {"slug": "veterany-by-meli-nove-proverovat-na-stk-navrhuji-poslanci", "coefficient": 0.2792190755856333}, {"slug": "boxster-jako-prvni-911-mozna-nikdy-sportaky-porsche-vyhlizeji-elektrinu", "coefficient": 0.2621289914674831}]";NULL
712451;22;"Evropa není pro automobilky volným trhem, říká šéf Mazdy v Česku";evropa-neni-pro-automobilky-volnym-trhem-rika-sef-mazdy-v-cesku;"„Problém je v překotnosti, s jakou se zavádějí různá pravidla,“ říká šéf českého a slovenského zastoupení Mazdy Alexej Kiriakovský. „Jsme nuceni prodávat auta, o která lidé nemají zájem,“ dodává. Podle zkušeného manažera elektroauta v dohledné době zlevnění nečeká. Kiriakovský také silně kritizuje nastavení dotací na nákup bateriových vozidel.";"„Problém je v překotnosti, s jakou se zavádějí různá pravidla,“ říká šéf českého a slovenského zastoupení Mazdy Alexej Kiriakovský. „Jsme nuceni prodávat auta, o která lidé nemají zájem,“ dodává. Podle zkušeného manažera elektroauta v dohledné době zlevnění nečeká. Kiriakovský také silně kritizuje nastavení dotací na nákup bateriových vozidel.<p><a href='https://www.idnes.cz/auto/zpravodajstvi/mazda-alexej-kiriakovsky-elektromobil-dotace.A210310_200334_automoto_fdv#utm_source=rss&utm_medium=feed&utm_campaign=autokat&utm_content=main'><b>Odkaz na původní článek</b></a></p>";https://www.idnes.cz/auto/zpravodajstvi/mazda-alexej-kiriakovsky-elektromobil-dotace.A210310_200334_automoto_fdv#utm_source=rss&utm_medium=feed&utm_campaign=autokat&utm_content=main;default.jpg;"2021-03-12 08:46:32";"2021-03-12 08:46:32";"2021-03-12 08:46:32";14;0;NULL;"zavádějí různá pravidla v dodává říká šéf českého kiriakovský říká lidé nemají zájem šéf pravidla zkušeného manažera elektroauta zavádějí překotnosti nákup bateriových vozidel bateriových problém";"[{"slug": "elektroauta-neni-kde-nabijet-evropa-musi-pridat-lamentuji-vyrobci", "coefficient": 0.29440498324875597}, {"slug": "nedostatek-cipu-zastavuje-vyrobu-automobilky-prijdou-o-miliardy", "coefficient": 0.2880359948946644}, {"slug": "mala-soucastka-velke-problemy-automobilky-jsou-v-pozici-kterou-neznaji", "coefficient": 0.28507660753364467}, {"slug": "automobilky-na-rozcesti-sebevrazda-elektrickym-proudem-je-jedinou-moznosti", "coefficient": 0.28278343413995044}, {"slug": "filmove-hvezdy-kombi-pro-osm-a-trabant-s-mazdou-kterym-urizli-strechu", "coefficient": 0.2821962892292032}, {"slug": "cinane-budou-vyrabet-obaly-baterii-elektroaut-v-kralupech-zadaji-o-pobidku", "coefficient": 0.2811335631628527}, {"slug": "vymena-baterie-v-elektromobilu-vyjde-i-na-vic-nez-polovinu-ceny-noveho-auta", "coefficient": 0.28081395127850833}, {"slug": "evropa-predstihla-cinu-v-prodejich-elektroaut-tahounem-jsou-nemecke-dotace", "coefficient": 0.27980590683721634}, {"slug": "tajemna-elektricka-kia-nastartuje-novou-eru-zatim-je-ve-stinu", "coefficient": 0.2781983721662827}, {"slug": "spocitali-jsme-kolik-stoji-kilometr-auta-na-elektrinu-se-stale-nevyplati", "coefficient": 0.27648445437872127}]";NULL
713271;22;"Století vládce Fiatu. Nekorunovaný král Itálie miloval moc a ženy";stoleti-vladce-fiatu-nekorunovany-kral-italie-miloval-moc-a-zeny;"Před sto lety, 12. března 1921, se narodil italský průmyslník Giovanni Agnelli, ve své době označovaný za šedou eminenci mocného klanu průmyslníků a nekorunovaného krále Itálie. Charismatický muž, který tři desítky let vedl koncern Fiat, vládl rodinnému impériu železnou rukou a pod jeho vedením prorazila automobilka do světa.";"Před sto lety, 12. března 1921, se narodil italský průmyslník Giovanni Agnelli, ve své době označovaný za šedou eminenci mocného klanu průmyslníků a nekorunovaného krále Itálie. Charismatický muž, který tři desítky let vedl koncern Fiat, vládl rodinnému impériu železnou rukou a pod jeho vedením prorazila automobilka do světa.<p><a href='https://www.idnes.cz/auto/zpravodajstvi/giovanni-agnelli-john-elkann-fiat-italie.A210311_130214_automoto_fdv#utm_source=rss&utm_medium=feed&utm_campaign=autokat&utm_content=main'><b>Odkaz na původní článek</b></a></p>";https://www.idnes.cz/auto/zpravodajstvi/giovanni-agnelli-john-elkann-fiat-italie.A210311_130214_automoto_fdv#utm_source=rss&utm_medium=feed&utm_campaign=autokat&utm_content=main;default.jpg;"2021-03-12 17:19:15";"2021-03-12 17:19:15";"2021-03-12 17:19:15";14;0;NULL;"nekorunovaného krále itálie března své vedením prorazila automobilka narodil italský průmyslník giovanni agnelli sto lety narodil době označovaný března charismatický muž lety";"[{"slug": "video-nejstarsi-motoznacku-evropy-proslavil-aerotunel-a-osmivalec", "coefficient": 0.30440567809848784}, {"slug": "jarni-smrst-suv-z-asie-na-vyber-jsou-drsnaci-i-terenaky-do-mesta", "coefficient": 0.29398669985574344}, {"slug": "uz-i-v-koline-dosly-cipy-toyota-zastavi-vyrobu-na-dva-tydny", "coefficient": 0.28576126334004115}, {"slug": "skoda-octavia-pro-nabizi-cinanum-vic-mista-pro-nohy", "coefficient": 0.28288529186930467}, {"slug": "skoda-ma-byt-klicem-k-uspechu-v-asii-pro-cely-koncern-vw", "coefficient": 0.2812351710762543}, {"slug": "rusky-ministr-odhalil-plan-vyroby-miniauta-na-elektrinu-vyjede-jeste-letos", "coefficient": 0.27665392981213943}, {"slug": "pul-stoleti-s-borcem-ktery-stavel-prazske-tunely-dnes-ho-ma-vytetovaneho", "coefficient": 0.27588089773929536}, {"slug": "vw-chysta-v-evrope-sest-tovaren-na-baterie-do-elektroaut-ve-hre-je-i-cesko", "coefficient": 0.2757404337746475}, {"slug": "elektricka-kia-je-symbolem-prerodu-znacky-spalovaci-motory-zatim-nezavrhla", "coefficient": 0.2755436541342562}, {"slug": "autofotka-tydne-zemrel-sochar-plechu-ktery-oblekal-nejdrazsi-auta-sveta", "coefficient": 0.27553676295253826}]";NULL
713761;22;"Tajemná elektrická kia nastartuje novou éru. Zatím je ve stínu";tajemna-elektricka-kia-nastartuje-novou-eru-zatim-je-ve-stinu;"První elektromobil, který bude postaven na vyhrazené platformě Kia pro elektromobily (E-GMP) a bude používat nové označení EV. Tím začíná nová éra značky a jejích bateriových aut.";"První elektromobil, který bude postaven na vyhrazené platformě Kia pro elektromobily (E-GMP) a bude používat nové označení EV. Tím začíná nová éra značky a jejích bateriových aut.<p><a href='https://www.idnes.cz/auto/zpravodajstvi/kia-elektromobil-ev6.A210312_152425_automoto_fdv#utm_source=rss&utm_medium=feed&utm_campaign=autokat&utm_content=main'><b>Odkaz na původní článek</b></a></p>";https://www.idnes.cz/auto/zpravodajstvi/kia-elektromobil-ev6.A210312_152425_automoto_fdv#utm_source=rss&utm_medium=feed&utm_campaign=autokat&utm_content=main;default.jpg;"2021-03-13 01:21:26";"2021-03-13 01:21:26";"2021-03-13 01:21:26";14;0;NULL;"vyhrazené platformě kia e aut jejích bateriových aut vyhrazené platformě kia elektromobily postaven označení ev elektromobil elektromobil první postaven e-gmp";"[{"slug": "elektricka-kia-je-symbolem-prerodu-znacky-spalovaci-motory-zatim-nezavrhla", "coefficient": 0.4346335375701018}, {"slug": "elektricke-citigo-je-bazarovy-hit-lezakem-je-range-rover", "coefficient": 0.3044991385772011}, {"slug": "cinane-budou-vyrabet-obaly-baterii-elektroaut-v-kralupech-zadaji-o-pobidku", "coefficient": 0.30096021837654113}, {"slug": "zkouseli-jsme-jak-elektromobil-bojuje-s-mrazy-nabijet-ho-chce-s-rozmyslem", "coefficient": 0.2983104790204527}, {"slug": "jarni-autonovinkou-je-elektricka-skoda-enyaq-oceneni-jsou-i-ctenari", "coefficient": 0.2916356479859884}, {"slug": "elektricka-vlna-pod-proudem-jsou-dodavky-i-supersport", "coefficient": 0.2906320623812365}, {"slug": "mala-soucastka-velke-problemy-automobilky-jsou-v-pozici-kterou-neznaji", "coefficient": 0.2872595628076401}, {"slug": "volva-budou-od-roku-2030-elektricka-koupite-je-pres-e-shop-a-bez-smlouvani", "coefficient": 0.285603727161944}, {"slug": "vyroba-vazne-prodeje-taky-na-auta-se-ceka-az-deset-mesicu", "coefficient": 0.28354240697494987}, {"slug": "novy-peugeot-308-je-tu-ma-novou-tvar-benzin-diesel-i-plug-in-hybridy", "coefficient": 0.282540862309624}]";NULL
