id;author_id;title;slug;excerpt;body;original_link;image;created_at;updated_at;published_at;category_id;views;deleted_at;keywords;recommended;meta_id
733111;22;"Ojetiny, které Češi chtějí: velké auto na naftu do čtvrt milionu";ojetiny-ktere-cesi-chteji-velke-auto-na-naftu-do-ctvrt-milionu;"Průměrná cena ojetých aut prodaných na českém trhu loni stoupla o pět procent na 234 900 Kč. Nejprodávanější byly diesely s průměrným stářím 9,5 roku a nájezdem 162 000 km. Oznámila to Asociace obchodu s ojetými automobily.";"Průměrná cena ojetých aut prodaných na českém trhu loni stoupla o pět procent na 234 900 Kč. Nejprodávanější byly diesely s průměrným stářím 9,5 roku a nájezdem 162 000 km. Oznámila to Asociace obchodu s ojetými automobily.<p><a href='https://www.idnes.cz/auto/zpravodajstvi/ojetina-bazar.A210330_134422_automoto_fdv#utm_source=rss&utm_medium=feed&utm_campaign=autokat&utm_content=main'><b>Odkaz na původní článek</b></a></p>";https://www.idnes.cz/auto/zpravodajstvi/ojetina-bazar.A210330_134422_automoto_fdv#utm_source=rss&utm_medium=feed&utm_campaign=autokat&utm_content=main;default.jpg;"2021-04-01 04:34:02";"2021-04-01 04:34:02";"2021-04-01 04:34:02";14;0;NULL;"nejprodávanější byly diesely cena ojetých aut prodaných českém nájezdem pět procent roku průměrným stářím 9 stářím asociace obchodu procent ojetými automobily průměrná";"[{"slug": "pokuty-vymahaji-po-tech-kterym-auto-nepatri-bazary-zadaji-opravu-zakona", "coefficient": 0.3175891520325133}, {"slug": "naftova-ojetina-za-sto-tisic-kdyz-na-dieselu-trvate-neni-moc-na-vyber", "coefficient": 0.31249269733243956}, {"slug": "elektricke-citigo-je-bazarovy-hit-lezakem-je-range-rover", "coefficient": 0.3097449589317173}, {"slug": "covidovy-paradox-poptavka-po-levnejsich-autech-spis-klesa", "coefficient": 0.2989582534518805}, {"slug": "mala-soucastka-velke-problemy-automobilky-jsou-v-pozici-kterou-neznaji", "coefficient": 0.29893192469942004}, {"slug": "skoda-chce-skrtnout-tri-tisice-mist-boji-se-odbory-vadi-jim-i-covidove-smeny", "coefficient": 0.29537824525016126}, {"slug": "vyroba-vazne-prodeje-taky-na-auta-se-ceka-az-deset-mesicu", "coefficient": 0.2923959242426275}, {"slug": "prezouvani-na-leto-brzdi-koronauzavera-cesi-se-snazi-usetrit", "coefficient": 0.2911154296589315}, {"slug": "prvni-nissan-qashqai-se-povedl-pri-nakupu-ojetiny-pozor-na-rez", "coefficient": 0.28873990371529}, {"slug": "chcete-vyvinout-a-vyrobit-auto-v-rakousku-umi-vsechno-offroad-i-supersport", "coefficient": 0.28601452483421463}]";NULL
733121;22;"První jízda elektrickou škodou. Enyaq je skvělý, ale musíte si na něj zvykat";prvni-jizda-elektrickou-skodou-enyaq-je-skvely-ale-musite-si-na-nej-zvykat;"Enyaq je na silnicích. S první škodovkou nové doby jsme najeli první stovky kilometrů. Ta doba je elektrická. Namísto nádrže má auto baterky a na elektrony z nich vystřelí jako čert.";"Enyaq je na silnicích. S první škodovkou nové doby jsme najeli první stovky kilometrů. Ta doba je elektrická. Namísto nádrže má auto baterky a na elektrony z nich vystřelí jako čert.<p><a href='https://www.idnes.cz/auto/zpravodajstvi/skoda-enyaq-iv-elektromobil-meb.A190724_214927_automoto_fdv#utm_source=rss&utm_medium=feed&utm_campaign=autokat&utm_content=main'><b>Odkaz na původní článek</b></a></p>";https://www.idnes.cz/auto/zpravodajstvi/skoda-enyaq-iv-elektromobil-meb.A190724_214927_automoto_fdv#utm_source=rss&utm_medium=feed&utm_campaign=autokat&utm_content=main;default.jpg;"2021-04-01 04:34:03";"2021-04-01 04:34:03";"2021-04-01 04:34:03";14;0;NULL;"stovky kilometrů silnicích doba nich vystřelí enyaq kilometrů enyaq z vystřelí jako první silnicích silnicích škodovkou enyaq";"[{"slug": "jarni-autonovinkou-je-elektricka-skoda-enyaq-oceneni-jsou-i-ctenari", "coefficient": 0.3736538396459465}, {"slug": "auta-s-turbinou-misto-motoru-se-neujala-pritom-jezdila-i-na-tequilu", "coefficient": 0.29075734547995746}, {"slug": "treskute-mrazy-pominuly-svleknete-detem-v-autosedackach-bundy", "coefficient": 0.28952890238387896}, {"slug": "komentar-jak-vas-jizda-s-youngtimerem-vyleci-z-lasky-ke-starym-autum", "coefficient": 0.2844251685754875}, {"slug": "ford-hlasi-ciste-elektrickou-budoucnost-malou-vyjimkou-budou-dodavky", "coefficient": 0.28347859808517023}, {"slug": "skoda-ukazuje-prvni-foto-nove-fabie-zustane-u-benzinu-premiera-bude-zjara", "coefficient": 0.2787573446365998}, {"slug": "k-ostrejsi-jizde-ho-musite-nutit-presto-je-sportovni-volvo-xc60-vrcholem", "coefficient": 0.2786959438127319}, {"slug": "bmw-m340d-vas-zapoji-do-deje-jako-kombik-nabizi-i-neco-navic", "coefficient": 0.27512316155676336}, {"slug": "novy-mercedes-c-je-zmensena-trida-s-ale-dostane-jen-ctyrvalce", "coefficient": 0.27497923449838363}, {"slug": "pokuty-vymahaji-po-tech-kterym-auto-nepatri-bazary-zadaji-opravu-zakona", "coefficient": 0.2715351119760368}]";NULL
733131;22;"Škoda má být klíčem k úspěchu v Asii pro celý koncern VW";skoda-ma-byt-klicem-k-uspechu-v-asii-pro-cely-koncern-vw;"Německá automobilka Volkswagen se pokusí prorazit na asijských trzích za pomoci své české součásti Škoda Auto. Právě do ní vkládá největší výrobce aut v Evropě naděje, napsala agentura Bloomberg.";"Německá automobilka Volkswagen se pokusí prorazit na asijských trzích za pomoci své české součásti Škoda Auto. Právě do ní vkládá největší výrobce aut v Evropě naděje, napsala agentura Bloomberg.<p><a href='https://www.idnes.cz/auto/magazin/skoda-volkswagen-indie-schafer.A210329_175246_auto_testy_fdv#utm_source=rss&utm_medium=feed&utm_campaign=autokat&utm_content=main'><b>Odkaz na původní článek</b></a></p>";https://www.idnes.cz/auto/magazin/skoda-volkswagen-indie-schafer.A210329_175246_auto_testy_fdv#utm_source=rss&utm_medium=feed&utm_campaign=autokat&utm_content=main;default.jpg;"2021-04-01 04:34:03";"2021-04-01 04:34:03";"2021-04-01 04:34:03";14;0;NULL;"německá automobilka volkswagen napsala agentura pokusí napsala agentura bloomberg automobilka volkswagen pokusí volkswagen pokusí prorazit automobilka asijských trzích auto evropě naděje německá";"[{"slug": "vw-chysta-v-evrope-sest-tovaren-na-baterie-do-elektroaut-ve-hre-je-i-cesko", "coefficient": 0.4273862801262458}, {"slug": "skoda-octavia-pro-nabizi-cinanum-vic-mista-pro-nohy", "coefficient": 0.35717673829186586}, {"slug": "skoda-je-pod-utoky-koncernu-vw-tlaci-na-setreni-zlobi-se-odbory", "coefficient": 0.3462942685531962}, {"slug": "hyundai-meni-u-elektromobilu-vadne-baterie-auta-z-nosovic-jsou-v-poradku", "coefficient": 0.31604248736244483}, {"slug": "v-pondeli-vyhlasi-evropske-auto-roku-sanci-ma-i-skoda-octavia", "coefficient": 0.3084153227471626}, {"slug": "skoda-ukazuje-prvni-foto-nove-fabie-zustane-u-benzinu-premiera-bude-zjara", "coefficient": 0.30751942849240754}, {"slug": "skoda-kodiaq-dostala-novou-prid-rso-vymenilo-tdi-za-benzin", "coefficient": 0.3060470796615745}, {"slug": "posledni-zachrana-bmw-prezilo-diky-italske-bubline-porsche-krisilo-suv", "coefficient": 0.30441466200555123}, {"slug": "rusky-ministr-odhalil-plan-vyroby-miniauta-na-elektrinu-vyjede-jeste-letos", "coefficient": 0.29982868499171833}, {"slug": "automobilka-volkswagen-koupi-v-cine-od-tesly-kredity-za-zelena-auta", "coefficient": 0.29980730046316545}]";NULL
733141;22;"Bomba na čtyřech kolech. Atomové auto potřebuje desítky tun stínění";bomba-na-ctyrech-kolech-atomove-auto-potrebuje-desitky-tun-stineni;"V době okouzlení jaderným štěpením se nápad nabízel. Mohlo by na jadernou energii jezdit i auto? Koncem padesátých let vzniklo několik konceptů a prototypů, které měly jedno společné. Nikdy nikdo nedotáhl k životu samotný princip pohonu.";"V době okouzlení jaderným štěpením se nápad nabízel. Mohlo by na jadernou energii jezdit i auto? Koncem padesátých let vzniklo několik konceptů a prototypů, které měly jedno společné. Nikdy nikdo nedotáhl k životu samotný princip pohonu.<p><a href='https://www.idnes.cz/auto/zpravodajstvi/atomove-auto-nuklearni-ford-nucleon-simca.A210319_083952_automoto_mom#utm_source=rss&utm_medium=feed&utm_campaign=autokat&utm_content=main'><b>Odkaz na původní článek</b></a></p>";https://www.idnes.cz/auto/zpravodajstvi/atomove-auto-nuklearni-ford-nucleon-simca.A210319_083952_automoto_mom#utm_source=rss&utm_medium=feed&utm_campaign=autokat&utm_content=main;default.jpg;"2021-04-01 04:34:03";"2021-04-01 04:34:03";"2021-04-01 04:34:03";14;0;NULL;"jadernou energii jezdit nabízel štěpením měly jedno společné okouzlení jaderným štěpením nápad jaderným nikdy nikdo nedotáhl okouzlení nápad nabízel době mohlo nabízel";"[{"slug": "nejlevnejsi-mobilita-v-krizi-auto-berte-co-nejjednodussi", "coefficient": 0.28707120937908787}, {"slug": "postarejte-se-po-zime-o-svou-plechovou-lasku-potrebuje-ocistu", "coefficient": 0.28246596494077497}, {"slug": "v-pondeli-vyhlasi-evropske-auto-roku-sanci-ma-i-skoda-octavia", "coefficient": 0.27430674195827104}, {"slug": "past-na-ridice-v-praze-desitky-aut-skoncily-v-tramvajovem-kolejisti", "coefficient": 0.27395175141515987}, {"slug": "slovaci-snili-o-alfe-postavili-garde-turbo-a-navrhli-nakladni-stodvacitku", "coefficient": 0.2730772570464522}, {"slug": "ojetiny-ktere-cesi-chteji-velke-auto-na-naftu-do-ctvrt-milionu", "coefficient": 0.27193916524707495}, {"slug": "auto-kolo-a-letadlo-v-jednom-legendarni-cesky-dalnik-zije-diky-nadsencum", "coefficient": 0.26998034875695504}, {"slug": "pokuty-vymahaji-po-tech-kterym-auto-nepatri-bazary-zadaji-opravu-zakona", "coefficient": 0.2699791811756512}, {"slug": "autopowerbanky-policek-energetickym-smejdum-a-flotily-enyaqu-misto-dukovan", "coefficient": 0.26865001080339773}, {"slug": "glosa-zcela-zbytecna-evidencka-jen-taha-penize-z-kapsy-zruste-ji", "coefficient": 0.26112379556237425}]";NULL
733151;22;"Kamioňáci nevěří svým očím. Osolí jim to rázná řidička sypače";kamionaci-neveri-svym-ocim-osoli-jim-to-razna-ridicka-sypace;"O rovném postavení žen v zaměstnání se hodně píše. Jsou však dámy, které si takovými věcmi hlavu nelámou a prostě se pustí do práce, která je láká. Jako rázná slečna Dvořáková, která krotí obří sypač na nejhůře sjízdném úseku v Čechách, v kopcích v okolí Harrachova. Za jeho volant se dostala náhodou.";"O rovném postavení žen v zaměstnání se hodně píše. Jsou však dámy, které si takovými věcmi hlavu nelámou a prostě se pustí do práce, která je láká. Jako rázná slečna Dvořáková, která krotí obří sypač na nejhůře sjízdném úseku v Čechách, v kopcích v okolí Harrachova. Za jeho volant se dostala náhodou.<p><a href='https://www.idnes.cz/auto/zpravodajstvi/sypac-ridicka-marcela-dvorakova-harrachov-drzkov-ave.A200725_124901_automoto_fdv#utm_source=rss&utm_medium=feed&utm_campaign=autokat&utm_content=main'><b>Odkaz na původní článek</b></a></p>";https://www.idnes.cz/auto/zpravodajstvi/sypac-ridicka-marcela-dvorakova-harrachov-drzkov-ave.A200725_124901_automoto_fdv#utm_source=rss&utm_medium=feed&utm_campaign=autokat&utm_content=main;default.jpg;"2021-04-01 04:34:03";"2021-04-01 04:34:03";"2021-04-01 04:34:03";14;0;NULL;"rovném postavení žen v zaměstnání rázná slečna dvořáková práce žen krotí obří sypač hlavu postavení nejhůře sjízdném úseku dostala rovném hodně píše rovném píše";"[{"slug": "normalni-auta-jeste-nevymrela-ds-veze-styl-bmw-emoce", "coefficient": 0.2708670052628706}, {"slug": "harley-jaky-nikdo-necekal-enduro-ma-sto-padesat-koni-a-sedlo-s-vytahem", "coefficient": 0.2683140334488354}, {"slug": "skoda-chce-skrtnout-tri-tisice-mist-boji-se-odbory-vadi-jim-i-covidove-smeny", "coefficient": 0.2677248389933009}, {"slug": "luxusni-atmosfera-a-poradne-stado-koni-jake-je-nejnovejsi-bmw-alpina-b7", "coefficient": 0.2634701535857619}, {"slug": "kazda-cesta-ma-cil-jedna-nemecka-okreska-se-vsak-toci-stale-dokola", "coefficient": 0.26308064790076213}, {"slug": "a-je-to-april-pripomente-si-povedene-kachny-v-podani-automobilek", "coefficient": 0.26216150481795747}, {"slug": "betonove-prahy-a-tenisak-v-perovani-jak-se-drive-vylepsovala-auta", "coefficient": 0.26111592565757125}, {"slug": "ojety-peugeot-308-slabiny-nema-jen-dobre-vybirejte-motor", "coefficient": 0.26057114298044937}, {"slug": "vybava-v-automobilovem-praveku-puncochy-hromosvod-a-prirucni-pneuservis", "coefficient": 0.26029982943132046}, {"slug": "bmw-m340d-vas-zapoji-do-deje-jako-kombik-nabizi-i-neco-navic", "coefficient": 0.25997072808833754}]";NULL
733161;22;"Ruský ministr odhalil plán výroby miniauta na elektřinu, vyjede ještě letos";rusky-ministr-odhalil-plan-vyroby-miniauta-na-elektrinu-vyjede-jeste-letos;"Malá soukromá ruská automobilka Zetta navrhla vlastní elektrický vůz a plánuje spustit jeho výrobu v letošním roce. Oznámil to ruský ministr průmyslu a obchodu Denis Manturov.";"Malá soukromá ruská automobilka Zetta navrhla vlastní elektrický vůz a plánuje spustit jeho výrobu v letošním roce. Oznámil to ruský ministr průmyslu a obchodu Denis Manturov.<p><a href='https://www.idnes.cz/auto/zpravodajstvi/rusko-elektromobil-zetta.A210327_091556_automoto_fdv#utm_source=rss&utm_medium=feed&utm_campaign=autokat&utm_content=main'><b>Odkaz na původní článek</b></a></p>";https://www.idnes.cz/auto/zpravodajstvi/rusko-elektromobil-zetta.A210327_091556_automoto_fdv#utm_source=rss&utm_medium=feed&utm_campaign=autokat&utm_content=main;default.jpg;"2021-04-01 04:34:04";"2021-04-01 04:34:04";"2021-04-01 04:34:04";14;0;NULL;"ruský ministr průmyslu automobilka zetta navrhla vlastní elektrický automobilka obchodu denis manturov ruská plánuje spustit soukromá letošním roce roce výrobu malá";"[{"slug": "huawei-planuje-vyrobu-elektromobilu-predstavi-je-snad-uz-letos", "coefficient": 0.36055263531206466}, {"slug": "vw-chysta-v-evrope-sest-tovaren-na-baterie-do-elektroaut-ve-hre-je-i-cesko", "coefficient": 0.32919834687793875}, {"slug": "skoda-octavia-pro-nabizi-cinanum-vic-mista-pro-nohy", "coefficient": 0.31281516739537496}, {"slug": "uz-i-v-koline-dosly-cipy-toyota-zastavi-vyrobu-na-dva-tydny", "coefficient": 0.30700079123031926}, {"slug": "boxster-jako-prvni-911-mozna-nikdy-sportaky-porsche-vyhlizeji-elektrinu", "coefficient": 0.3032705368876924}, {"slug": "skoda-ma-byt-klicem-k-uspechu-v-asii-pro-cely-koncern-vw", "coefficient": 0.29982868499171833}, {"slug": "ford-hlasi-ciste-elektrickou-budoucnost-malou-vyjimkou-budou-dodavky", "coefficient": 0.2980836458691582}, {"slug": "elektricka-kia-je-symbolem-prerodu-znacky-spalovaci-motory-zatim-nezavrhla", "coefficient": 0.2955291624943852}, {"slug": "skoda-kodiaq-dostala-novou-prid-rso-vymenilo-tdi-za-benzin", "coefficient": 0.28854893479658394}, {"slug": "hyundai-meni-u-elektromobilu-vadne-baterie-auta-z-nosovic-jsou-v-poradku", "coefficient": 0.2913435722149844}]";NULL
733171;22;"Lekce moderního myšlení. ID.4 vysvětluje, jak skončí automobilismus";lekce-moderniho-mysleni-id-4-vysvetluje-jak-skonci-automobilismus;"Autoprůmysl prochází největší změnou v historii. A změnit se bude muset i publikum – o těch našich milovaných a nenáviděných plechovkách se budeme muset naučit přemýšlet a mluvit úplně jinak. S tím se taky změní náš slovník a vůbec celý pohled na vnímání aut. První lekci změny myšlení dává VW ID.4.";"Autoprůmysl prochází největší změnou v historii. A změnit se bude muset i publikum – o těch našich milovaných a nenáviděných plechovkách se budeme muset naučit přemýšlet a mluvit úplně jinak. S tím se taky změní náš slovník a vůbec celý pohled na vnímání aut. První lekci změny myšlení dává VW ID.4.<p><a href='https://www.idnes.cz/auto/zpravodajstvi/vw-volkswagen-id-4-elektromobil.A210328_153150_automoto_fdv#utm_source=rss&utm_medium=feed&utm_campaign=autokat&utm_content=main'><b>Odkaz na původní článek</b></a></p>";https://www.idnes.cz/auto/zpravodajstvi/vw-volkswagen-id-4-elektromobil.A210328_153150_automoto_fdv#utm_source=rss&utm_medium=feed&utm_campaign=autokat&utm_content=main;default.jpg;"2021-04-01 04:34:04";"2021-04-01 04:34:04";"2021-04-01 04:34:04";14;0;NULL;"těch našich milovaných prochází největší změnou v změnou mluvit úplně jinak úplně největší vůbec celý pohled prochází nenáviděných plechovkách historii taky změní autoprůmysl";"[{"slug": "mala-soucastka-velke-problemy-automobilky-jsou-v-pozici-kterou-neznaji", "coefficient": 0.2877218475115692}, {"slug": "vysoka-skola-marketingu-jak-voltswagen-vsechny-nachytal-na-elektromobilitu", "coefficient": 0.27973959178442775}, {"slug": "stejna-konstrukce-jiny-vysledek-v-cem-jsou-tlumice-dnesnich-aut-lepsi", "coefficient": 0.2789062192770981}, {"slug": "nove-audi-vypada-skvele-proto-ze-je-elektricke-vysvetluje-designer", "coefficient": 0.2772959471897688}, {"slug": "spalovaci-motory-skonci-za-14-let-zni-z-eu-predpisy-nesplni-ani-hybridy", "coefficient": 0.2720556774801932}, {"slug": "elektricka-kia-je-symbolem-prerodu-znacky-spalovaci-motory-zatim-nezavrhla", "coefficient": 0.2703216488559039}, {"slug": "autofotka-tydne-nejmensi-mazda-se-vesla-do-kufru-v-evrope-ho-ztratili", "coefficient": 0.2695795480726962}, {"slug": "vyroba-vazne-prodeje-taky-na-auta-se-ceka-az-deset-mesicu", "coefficient": 0.2695789448891912}, {"slug": "novy-superb-dorazi-za-dva-roky-cesky-designer-nacrtl-jak-by-mohl-vypadat", "coefficient": 0.2694751570707461}, {"slug": "komentar-jak-vas-jizda-s-youngtimerem-vyleci-z-lasky-ke-starym-autum", "coefficient": 0.26035009404131343}]";NULL
733181;22;"Holka do nepohody. Lehkonohá Aprilia Tuono je pohodářka i dračice";holka-do-nepohody-lehkonoha-aprilia-tuono-je-pohodarka-i-dracice;"Každý sportovně založený motorkář by chtěl mašinu s charakterem litrového superbiku, ale přitom s lehkostí a ovladatelností stopětadvacítky! A kdyby ještě mohla být nejen na okruh, ale taky pohodlná do běžného provozu, na dojíždění do města a jízdu se spolujezdcem, to by bylo super.";"Každý sportovně založený motorkář by chtěl mašinu s charakterem litrového superbiku, ale přitom s lehkostí a ovladatelností stopětadvacítky! A kdyby ještě mohla být nejen na okruh, ale taky pohodlná do běžného provozu, na dojíždění do města a jízdu se spolujezdcem, to by bylo super.<p><a href='https://www.idnes.cz/auto/motorky/aprilia-tuono-600.A210326_072449_automoto_mom#utm_source=rss&utm_medium=feed&utm_campaign=autokat&utm_content=main'><b>Odkaz na původní článek</b></a></p>";https://www.idnes.cz/auto/motorky/aprilia-tuono-600.A210326_072449_automoto_mom#utm_source=rss&utm_medium=feed&utm_campaign=autokat&utm_content=main;default.jpg;"2021-04-01 04:34:04";"2021-04-01 04:34:04";"2021-04-01 04:34:04";14;0;NULL;"sportovně založený motorkář každý sportovně založený motorkář sportovně charakterem litrového superbiku běžného stopětadvacítky chtěl mašinu přitom ovladatelností stopětadvacítky superbiku taky pohodlná každý";"[{"slug": "elektricke-citigo-je-bazarovy-hit-lezakem-je-range-rover", "coefficient": 0.2708485583691412}, {"slug": "jarni-smrst-suv-z-asie-na-vyber-jsou-drsnaci-i-terenaky-do-mesta", "coefficient": 0.26960386714624673}, {"slug": "novela-bodoveho-systemu-se-asi-do-voleb-nestihne-zadrhla-se-v-parlamentu", "coefficient": 0.2681469192465671}, {"slug": "osudova-triadvacitka-pro-motocyklovou-legendu-znamenala-radost-i-smrt", "coefficient": 0.26735703814908973}, {"slug": "ridici-neznaji-pravidla-jizdy-po-kruhovem-objezdu-zopakujte-si-je", "coefficient": 0.26642690091125965}, {"slug": "huawei-planuje-vyrobu-elektromobilu-predstavi-je-snad-uz-letos", "coefficient": 0.26588697086377794}, {"slug": "dvouvalcovy-kamzik-je-nejlepsi-auto-do-kalamity-fiat-panda-radi-ve-snehu", "coefficient": 0.26561814929820604}, {"slug": "autofotka-tydne-aventadoru-je-deset-let-zurivec-bez-strechy-je-jediny", "coefficient": 0.26416698616071144}, {"slug": "lekce-moderniho-mysleni-id-4-vysvetluje-jak-skonci-automobilismus", "coefficient": 0.2637196526210862}, {"slug": "vw-chysta-v-evrope-sest-tovaren-na-baterie-do-elektroaut-ve-hre-je-i-cesko", "coefficient": 0.2636515063958196}]";NULL
733191;22;"Ojetý Renault Scénic je nečekaně bezproblémový. Dieselu sáhněte do výfuku";ojety-renault-scenic-je-necekane-bezproblemovy-dieselu-sahnete-do-vyfuku;"Objevili jsme možná ideálního kandidáta na vůz pro „vícedětné“ rodiny. Výhody? Úsporný a odolný motor i mechanika, minimum typických závad a až nelogicky nízké ceny kvůli nevalné pověsti minulých generací.";"Objevili jsme možná ideálního kandidáta na vůz pro „vícedětné“ rodiny. Výhody? Úsporný a odolný motor i mechanika, minimum typických závad a až nelogicky nízké ceny kvůli nevalné pověsti minulých generací.<p><a href='https://www.idnes.cz/auto/zpravodajstvi/renault-grand-scenic-test-ojetina-za-200-tisic.A210316_213632_autoservis_taj#utm_source=rss&utm_medium=feed&utm_campaign=autokat&utm_content=main'><b>Odkaz na původní článek</b></a></p>";https://www.idnes.cz/auto/zpravodajstvi/renault-grand-scenic-test-ojetina-za-200-tisic.A210316_213632_autoservis_taj#utm_source=rss&utm_medium=feed&utm_campaign=autokat&utm_content=main;default.jpg;"2021-04-01 04:34:04";"2021-04-01 04:34:04";"2021-04-01 04:34:04";14;0;NULL;"možná ideálního kandidáta výhody výhody minimum typických závad rodiny rodiny. odolný motor vícedětné vůz objevili kandidáta vůz objevili vůz vícedětné";"[{"slug": "ojety-peugeot-308-slabiny-nema-jen-dobre-vybirejte-motor", "coefficient": 0.28585852523323124}, {"slug": "marna-vira-v-jednu-stopu-auta-vyvazovana-gyroskopem-jezdila-hitem-se-nestala", "coefficient": 0.2803450573818882}, {"slug": "naftova-ojetina-za-sto-tisic-kdyz-na-dieselu-trvate-neni-moc-na-vyber", "coefficient": 0.28023691255628147}, {"slug": "necekane-dobre-svezeni-sportovne-razenemu-opelu-insignia-chybi-jen-jiskra-navic", "coefficient": 0.2786115171262655}, {"slug": "nova-fabia-extremne-narostla-dostane-az-150-koni-uz-jsme-s-ni-jeli", "coefficient": 0.2753764018204031}, {"slug": "motor-1-6-tdi-v-ojetinach-je-jen-pro-dalkove-jezdce-chtejte-ten-novejsi", "coefficient": 0.2727701901360743}, {"slug": "uz-i-v-koline-dosly-cipy-toyota-zastavi-vyrobu-na-dva-tydny", "coefficient": 0.269320002827248}, {"slug": "dojezd-elektrickych-nissanu-prodlouzi-spalovaci-motor-s-rekordni-ucinnosti", "coefficient": 0.26695234251301847}, {"slug": "autoskoly-zrusily-zkousky-vlada-je-zakazala-do-budoucna-ocekavaji-napor", "coefficient": 0.26356017471426085}, {"slug": "elektromobily-ztrati-do-ctyr-let-az-70-procent-hodnoty-tvrdi-studie", "coefficient": 0.2629467692143285}]";NULL
733201;22;"Autozápisník: Nobelovka za marketing, podezřelý milionář a auta podle Freuda";autozapisnik-nobelovka-za-marketing-podezrely-milionar-a-auta-podle-freuda;"Boleslavský „milionář“, vypečená nabídka německého diskontu a proč je nový technokrál Musk v Číně považován za krále špionů? Nové francouzské „koště“ v čele Jaguaru a Land Roveru odhalilo jen dvoudenní britský pracovní týden. A co by na překvapivé srovnání dvou anket řekl Sigmund Freud? Čtěte březnový autozápisník.";"Boleslavský „milionář“, vypečená nabídka německého diskontu a proč je nový technokrál Musk v Číně považován za krále špionů? Nové francouzské „koště“ v čele Jaguaru a Land Roveru odhalilo jen dvoudenní britský pracovní týden. A co by na překvapivé srovnání dvou anket řekl Sigmund Freud? Čtěte březnový autozápisník.<p><a href='https://www.idnes.cz/auto/zpravodajstvi/musk-tesla-auto-roku-autozapisnik-skoda-land-rover.A210324_174149_automoto_fdv#utm_source=rss&utm_medium=feed&utm_campaign=autokat&utm_content=main'><b>Odkaz na původní článek</b></a></p>";https://www.idnes.cz/auto/zpravodajstvi/musk-tesla-auto-roku-autozapisnik-skoda-land-rover.A210324_174149_automoto_fdv#utm_source=rss&utm_medium=feed&utm_campaign=autokat&utm_content=main;default.jpg;"2021-04-01 04:34:05";"2021-04-01 04:34:05";"2021-04-01 04:34:05";14;0;NULL;"land roveru odhalilo milionář vypečená nabídka německého diskontu nabídka čtěte březnový autozápisník špionů boleslavský „milionář vypečená technokrál musk milionář číně považován boleslavský";"[{"slug": "autozapisnik-jeep-je-na-musce-indianu-a-sef-vw-se-dal-na-youtubering", "coefficient": 0.28521109240869985}, {"slug": "automobilka-volkswagen-koupi-v-cine-od-tesly-kredity-za-zelena-auta", "coefficient": 0.28002471740328355}, {"slug": "vymena-baterie-v-elektromobilu-vyjde-i-na-vic-nez-polovinu-ceny-noveho-auta", "coefficient": 0.2765768430858689}, {"slug": "na-uzovky-je-musk-kratky-teslu-v-nemecku-brzdi-byrokracie-a-spici-jesterky", "coefficient": 0.2764738453522849}, {"slug": "spocitali-jsme-kolik-stoji-kilometr-auta-na-elektrinu-se-stale-nevyplati", "coefficient": 0.2757367203629463}, {"slug": "honba-za-vykonem-nekonci-nova-nejrychlejsi-auta-jsou-zase-o-neco-rychlejsi", "coefficient": 0.2726172100016804}, {"slug": "marna-vira-v-jednu-stopu-auta-vyvazovana-gyroskopem-jezdila-hitem-se-nestala", "coefficient": 0.2702647140777637}, {"slug": "betonove-prahy-a-tenisak-v-perovani-jak-se-drive-vylepsovala-auta", "coefficient": 0.2697610763847257}, {"slug": "auta-cechu-patri-k-nejstarsim-v-evrope-prumer-roste-kvuli-dovozu", "coefficient": 0.2695647990573027}, {"slug": "vyroba-vazne-prodeje-taky-na-auta-se-ceka-az-deset-mesicu", "coefficient": 0.2696310245247563}]";NULL
